<?xml version="1.0" encoding="UTF-8"?>
<DataDicMap xmlns="http://www.legend.com/DataDicMap.xsd"
	xmlns:xsi="http://www.w3.org/2001/XMLSchema-instance"
	xsi:schemaLocation="http://www.legend.com/DataDicMap.xsd DataDicMap.xsd">
	<DataDic>
		<DataCode>ID</DataCode>
		<DataType>java.lang.String</DataType>
		<Desc>ID</Desc>
	</DataDic>
	<DataDic>
		<DataCode>CODE</DataCode>
		<DataType>java.lang.String</DataType>
		<Desc>CODE</Desc>
	</DataDic>
</DataDicMap>