<?xml version="1.0" encoding="UTF-8"?>
<DataDicMap xmlns="http://www.legend.com/DataDicMap.xsd"
	xmlns:xsi="http://www.w3.org/2001/XMLSchema-instance"
	xsi:schemaLocation="http://www.legend.com/DataDicMap.xsd DataDicMap.xsd">
	<DataDic>
		<DataCode>ID1</DataCode>
		<DataType>java.lang.String</DataType>
		<Desc>ID1</Desc>
	</DataDic>
	<DataDic>
		<DataCode>ID2</DataCode>
		<DataType>java.lang.String</DataType>
		<Desc>ID2</Desc>
	</DataDic>
	<DataDic>
		<DataCode>REQDATE</DataCode>
		<DataType>java.lang.String</DataType>
		<Desc>REQDATE</Desc>
	</DataDic>
	<DataDic>
		<DataCode>VERSION</DataCode>
		<DataType>java.lang.String</DataType>
		<Desc>VERSION</Desc>
	</DataDic>
	<DataDic>
		<DataCode>CUR</DataCode>
		<DataType>java.lang.Short</DataType>
		<Desc>CUR</Desc>
	</DataDic>
	<DataDic>
		<DataCode>INSTID</DataCode>
		<DataType>java.lang.String</DataType>
		<Desc>INSTID</Desc>
	</DataDic>
	<DataDic>
		<DataCode>CERTID</DataCode>
		<DataType>java.lang.String</DataType>
		<Desc>CERTID</Desc>
	</DataDic>
	<DataDic>
		<DataCode>SERIALNO</DataCode>
		<DataType>java.lang.Long</DataType>
		<Desc>SERIALNO</Desc>
	</DataDic>
	<DataDic>
		<DataCode>SIGNNO</DataCode>
		<DataType>java.lang.Long</DataType>
		<Desc>SIGNNO</Desc>
	</DataDic>
	<DataDic>
		<DataCode>CHARGE</DataCode>
		<DataType>java.lang.Byte</DataType>
		<Desc>CHARGE</Desc>
	</DataDic>
	<DataDic>
		<DataCode>AMOUNT</DataCode>
		<DataType>java.lang.Short</DataType>
		<Desc>AMOUNT</Desc>
	</DataDic>
	<DataDic>
		<DataCode>RspMsg</DataCode>
		<DataType>java.lang.String</DataType>
		<Desc>RspMsg</Desc>
	</DataDic>
	<DataDic>
		<DataCode>RspCode</DataCode>
		<DataType>java.lang.String</DataType>
		<Desc>RspCode</Desc>
	</DataDic>
</DataDicMap>